smartctl 7.4 2023-08-01 r5530 [x86_64-linux-6.8.0-58-generic] (local build)
Copyright (C) 2002-23, Bruce Allen, Christian Franke, www.smartmontools.org

=== START OF READ SMART DATA SECTION ===
SMART Attributes Data Structure revision number: 16
Vendor Specific SMART Attributes with Thresholds:
ID# ATTRIBUTE_NAME          FLAG     VALUE WORST THRESH TYPE      UPDATED  WHEN_FAILED RAW_VALUE
  1 Raw_Read_Error_Rate     0x000b   100   100   050    Pre-fail  Always       -       0
  2 Throughput_Performance  0x0005   100   100   050    Pre-fail  Offline      -       0
  3 Spin_Up_Time            0x0027   100   100   001    Pre-fail  Always       -       5795
  4 Start_Stop_Count        0x0032   100   100   000    Old_age   Always       -       28
  5 Reallocated_Sector_Ct   0x0033   100   100   010    Pre-fail  Always       -       0
  7 Seek_Error_Rate         0x000b   100   100   050    Pre-fail  Always       -       0
  8 Seek_Time_Performance   0x0005   100   100   050    Pre-fail  Offline      -       0
  9 Power_On_Hours          0x0032   100   100   000    Old_age   Always       -       44
 10 Spin_Retry_Count        0x0033   100   100   030    Pre-fail  Always       -       0
 12 Power_Cycle_Count       0x0032   100   100   000    Old_age   Always       -       28
 23 Unknown_Attribute       0x0023   100   100   075    Pre-fail  Always       -       0
 24 Unknown_Attribute       0x0023   100   100   075    Pre-fail  Always       -       0
 27 Unknown_Attribute       0x0023   100   100   030    Pre-fail  Always       -       723021
191 G-Sense_Error_Rate      0x0032   100   100   000    Old_age   Always       -       0
192 Power-Off_Retract_Count 0x0032   100   100   000    Old_age   Always       -       10
193 Load_Cycle_Count        0x0032   100   100   000    Old_age   Always       -       59
194 Temperature_Celsius     0x0022   100   100   000    Old_age   Always       -       31 (Min/Max 18/34)
196 Reallocated_Event_Count 0x0033   100   100   010    Pre-fail  Always       -       0
197 Current_Pending_Sector  0x0032   100   100   000    Old_age   Always       -       0
198 Offline_Uncorrectable   0x0030   100   100   000    Old_age   Offline      -       0
199 UDMA_CRC_Error_Count    0x0032   200   200   000    Old_age   Always       -       0
220 Disk_Shift              0x0002   100   100   000    Old_age   Always       -       34734082
222 Loaded_Hours            0x0032   100   100   000    Old_age   Always       -       15
223 Load_Retry_Count        0x0032   100   100   000    Old_age   Always       -       0
224 Load_Friction           0x0022   100   100   000    Old_age   Always       -       0
226 Load-in_Time            0x0026   100   100   000    Old_age   Always       -       614
240 Head_Flying_Hours       0x0001   100   100   001    Pre-fail  Offline      -       0
241 Total_LBAs_Written      0x0032   100   100   000    Old_age   Always       -       204109965
242 Total_LBAs_Read         0x0032   100   100   000    Old_age   Always       -       81269467

smartctl 7.4 2023-08-01 r5530 [x86_64-linux-6.8.0-58-generic] (local build)
Copyright (C) 2002-23, Bruce Allen, Christian Franke, www.smartmontools.org

=== START OF READ SMART DATA SECTION ===
SMART Attributes Data Structure revision number: 16
Vendor Specific SMART Attributes with Thresholds:
ID# ATTRIBUTE_NAME          FLAG     VALUE WORST THRESH TYPE      UPDATED  WHEN_FAILED RAW_VALUE
  1 Raw_Read_Error_Rate     0x000b   100   100   050    Pre-fail  Always       -       0
  2 Throughput_Performance  0x0005   100   100   050    Pre-fail  Offline      -       0
  3 Spin_Up_Time            0x0027   100   100   001    Pre-fail  Always       -       5795
  4 Start_Stop_Count        0x0032   100   100   000    Old_age   Always       -       28
  5 Reallocated_Sector_Ct   0x0033   100   100   010    Pre-fail  Always       -       0
  7 Seek_Error_Rate         0x000b   100   100   050    Pre-fail  Always       -       0
  8 Seek_Time_Performance   0x0005   100   100   050    Pre-fail  Offline      -       0
  9 Power_On_Hours          0x0032   100   100   000    Old_age   Always       -       44
 10 Spin_Retry_Count        0x0033   100   100   030    Pre-fail  Always       -       0
 12 Power_Cycle_Count       0x0032   100   100   000    Old_age   Always       -       28
 23 Unknown_Attribute       0x0023   100   100   075    Pre-fail  Always       -       0
 24 Unknown_Attribute       0x0023   100   100   075    Pre-fail  Always       -       0
 27 Unknown_Attribute       0x0023   100   100   030    Pre-fail  Always       -       723024
191 G-Sense_Error_Rate      0x0032   100   100   000    Old_age   Always       -       0
192 Power-Off_Retract_Count 0x0032   100   100   000    Old_age   Always       -       10
193 Load_Cycle_Count        0x0032   100   100   000    Old_age   Always       -       59
194 Temperature_Celsius     0x0022   100   100   000    Old_age   Always       -       31 (Min/Max 18/34)
196 Reallocated_Event_Count 0x0033   100   100   010    Pre-fail  Always       -       0
197 Current_Pending_Sector  0x0032   100   100   000    Old_age   Always       -       0
198 Offline_Uncorrectable   0x0030   100   100   000    Old_age   Offline      -       0
199 UDMA_CRC_Error_Count    0x0032   200   200   000    Old_age   Always       -       0
220 Disk_Shift              0x0002   100   100   000    Old_age   Always       -       34734082
222 Loaded_Hours            0x0032   100   100   000    Old_age   Always       -       15
223 Load_Retry_Count        0x0032   100   100   000    Old_age   Always       -       0
224 Load_Friction           0x0022   100   100   000    Old_age   Always       -       0
226 Load-in_Time            0x0026   100   100   000    Old_age   Always       -       614
240 Head_Flying_Hours       0x0001   100   100   001    Pre-fail  Offline      -       0
241 Total_LBAs_Written      0x0032   100   100   000    Old_age   Always       -       213064357
242 Total_LBAs_Read         0x0032   100   100   000    Old_age   Always       -       81269467

